{"canonical_manifest_digest":"c7cb66d707aa75c0cb2bb07a82678964f9e285c9d2c783969507554c8d9f17b0","declared_roots":["docs/audits/skill-system-overhaul-t0-2026-07-24.md","docs/evidence/proof-epochs/epoch-0/t0-pause-drill.json","docs/evidence/proof-epochs/epoch-0b/t0-ref-safety-repair-intent.md","docs/plans/2026-07-24-skill-system-overhaul.md","scripts/check-t0-evidence.py","tests/python/test_check_t0_evidence.py"],"entries":[{"digest":"4545fe1080979ea6b655f8910723d96db3b159756a7124e34bb9a328ecd34506","executable":false,"kind":"file","path":"docs/audits/skill-system-overhaul-t0-2026-07-24.md"},{"digest":"5463231145e9a4167ea8e616061d50f2db70608b8f17ac74ca41ac5a784ce913","executable":false,"kind":"file","path":"docs/evidence/proof-epochs/epoch-0/t0-pause-drill.json"},{"digest":"888257eab3c062f61ed94e12ebc964ea0de2de405ca781ebdc00346d7d742043","executable":false,"kind":"file","path":"docs/evidence/proof-epochs/epoch-0b/t0-ref-safety-repair-intent.md"},{"digest":"e5cb8d7de5989c8fb3b8fc56e31b18595f00216403114b7fae966c250798d73e","executable":false,"kind":"file","path":"docs/plans/2026-07-24-skill-system-overhaul.md"},{"digest":"08477aacfdd6ba3397cd72f97f889f04e4d7c75ff2c5bda91a6dbae5a910a5bb","executable":false,"kind":"file","path":"scripts/check-t0-evidence.py"},{"digest":"0ea6d85222c4d378cdde125fb4f99cbaad58b6d2cbc01d58654d598b3580cbc1","executable":false,"kind":"file","path":"tests/python/test_check_t0_evidence.py"}],"exclusions":[],"git_metadata":{"base":"1016ae749f1656be692b159f1e13ceb9e868c28b","candidate":"2ebf3594bd7c8bf9e1574aaccebd5a048d32dd70"},"schema_version":"subject-manifest.v1"}
